{
  "schema": "agent-scripts.implement-ticket/capability-manifest/v1",
  "id": "agent-scripts.implement-ticket/delegated-execution/v1",
  "contract": "CONTRACT.md",
  "invocation_schema": "invocation.schema.json",
  "checkpoint_request_schema": "checkpoint-request.schema.json",
  "checkpoint_response_schema": "checkpoint-response.schema.json",
  "result_schema": "result.schema.json",
  "validator": "validate.py",
  "terminal_states": [
    "ready_pr",
    "ready_prs",
    "merged",
    "blocked",
    "requires_epic"
  ],
  "checkpoint_phases": [
    "pre_external_mutation",
    "candidate_published"
  ]
}
